"compound","sentence1","sentence2","sentence3"
"ovelha negra","Ele sempre foi o que você poderia chamar de diferente da família .","Já Eduardo Cunha deve sair do processo como a pessoa diferente do partido .","É claro que ela era a diferente da família , muito diferente de todos os demais ."
"pão-duro","Era um mão de vaca , um avarento .","O mão de vaca quer que seu cão seja tratado de graça .","Mas o mão de vaca não consegue pagar e recebe uma carta de cobrança ."
"papel higiênico","Forneciam sabonete , toalha e papel .","Coloque assentos nos vasos - sanitários , sabonete líquido , papel toalha individual e papel nos sanitários masculino e feminino dos alunos .","Pegue um pedaço de papel toalha ou papel , embeba em álcool e passe sobre a placa ; vá passando o papel até que não saia mais fuligem ."
"paraíso fiscal","Como se os seus donos tivessem embolsado os ganhos e mandado para algum refúgio fiscal .","A ilha de Jersey é considerada um refúgio fiscal .","A empresa também é suspeita de manter contas em refúgios fiscais através da M - Cor Holding ."
"pastor alemão","Pit Bulls , Rottweilers e cachorros também apresentam maior incidência de displasia coxo - femural .","Quando voltou aos Estados Unidos , ele trouxe um cachorro chamado Buddy .","As raças analisadas são , entre outras , o Golden Retriever e o cachorro para o câncer ."
"pau-mandado","Este submisso dos poderosos da Europa , este borra - botas pensa que já o esquecemos ?","Como um bom submisso , ele entregou as imensas riquezas de mineração e petróleo congolesas a corporações multinacionais .","A cidade não precisa de um submisso dos governos federal ou estadual para se sentir segura em esse processo ."
"pavio curto","É conhecido por sua falta de paciência e comportamento agressivo .","Sem paciência , admitiu que não tinha talento para obedecer ordens .","É impaciente , não tolera irreverências , coisas que acha fora de padrão ."
"pé quente","Espero confirmar lá no final do campeonato esta fama de sortudo .","O sortudo Cláudio Assis é , no Brasil , um recordista de prêmios .","Sou sortudo e gosto de vestir a camisa do time em que estou jogando ."
"pé-direito","Considera - se altura a altura compreendida entre o piso e o forro acabados .","Tijolos aparentes , altura alta e decoração moderna e bonitinha .","Todos os ambientes terão altura dupla ."
"pé-frio","Azarado é pouco para definir certos graus de azar inexplicáveis .","Após perder duas copas do mundo no comando da seleção brasileira de futebol , amargou por muito tempo a fama de azarado .","Ganhou até uma fama de "" azarado "" , por ter alguns rebaixamentos em seu currículo obviamente , folclore ."
"pente fino","Nós agora temos que fazer uma operação análise minuciosa .","Após uma análise minuciosa , a CGU apurou que a licitação para oito rotas foi forjada .","A Nature usa o método de amostragem , escolhendo um trabalho por edição para a análise minuciosa ."
"peso morto","Mas além do inútil eles geram outro desperdício .","Uma entidade , a paróquia , parecia ter se tornado sem utilidade e inútil .","Muitos fracassam na vida e se tornam inúteis , porque não se dão conta de isso ."
"planta baixa","Finalizaremos a planta do pavimento inferior .","Exercício : desenhar a planta da figura abaixo na escala de 1 : 50 .","Por - que não faz a planta de seu espaço de trabalho e projeta da forma que lhe for mais confortável ?"
"poção mágica","Para ser feliz não existe elixir .","De manhã , beba em jejum esse magnífico elixir de força e bem - estar .","Ela usou um elixir para transportá - lo , enquanto ele dormia ."
"pólo-aquático","Filho de brasileiros , ele foi vice - campeão olímpico de pólo na água pelos Estados Unidos em Pequim .","O pólo na água também faz parte do quadro de desportos dos jogos olímpicos .","Os atletas amadores preferem utilizar o lago para natação ou um jogo de pólo na água ."
"ponto cego","Estes aparelhos simulam o movimento natural das ondas permitindo evitar pontos ocultos .","Já no trânsito , a precariedade visual provoca excesso de pontos ocultos .","Cabe então nos perguntarmos : quais são os pontos ocultos da nossa ciência de hoje ?"
"ponto forte","Quais são suas qualidades ?","Ambas tem qualidades e fracos .","Todos nós temos qualidades e fragilidades ."
"ponto fraco","O projeto era simétrico , sem fraquezas .","E para reconhecer fraquezas é necessário muita maturidade .","Descubra o que seus clientes valorizam e quais são suas fraquezas ."
"prato feito","Escolhemos o prato pronto por R$ 15 , 00 .","Se você for comer na rua o prato típico é o Tali , que em Hindi quer dizer prato pronto .","Só tinha um cara , que eu saquei que devia ser o zelador , comendo um prato pronto , sentado perto de uma das janelas ."
"primeira infância","Isso se desenvolve desde os primeiros anos de vida .","Dos meus primeiros anos de vida só tenho lembranças felizes .","Apavorei - me com o tema : diversidade sexual nos primeiros anos de vida ."
"primeira mão","Lembram que este blog deu em novidade que a Procuradoria Geral da República tinha publicado um site explicando o Mensalão para as crianças ?","Encerrada a ligação , me dei conta de que tinha informações extraordinárias , obtidas de uma testemunha de novidade .","Matilde tinha caído depois que o Coturno Noturno denunciou , em novidade , as suas compras no Duty Free com dinheiro público ."
"primeira necessidade","Na ordem de prioridade dos usos da água , essa é a prioridade a ser atendida .","Os proprietários dos imóveis poderão usar das águas do aqueduto para as prioridades da vida .","O possuidor do imóvel superior não poderá poluir as águas indispensáveis às prioridades da vida dos possuidores dos imóveis inferiores ."
"primeira-dama","Foram padrinhos o prefeito e a esposa do presidente de Patrocínio Paulista .","Jorginho conta que Luviana é uma esposa do presidente com jeito de primeira ministra .","Siqueira deve viajar o nordeste em companhia da esposa do presidente . . ."
"primeiro ministro","Sócrates foi um péssimo chefe de estado ?","Considere - se o chefe de estado britânico David Cameron .","Tancredo Neves abriu a lista de chefes de estado ."
"primeiro plano","Um destaque mostra a tensão de seu semblante .","Eu realmente consigo trazer a emoção para a prioridade .","O sentido da sua vida ficou em prioridade ."
"príncipe encantado","Elas ainda são criadas para acreditar no homem perfeito .","Eu nunca esperei um homem perfeito pelo contrário , sempre achei os sapos mais interessantes !","As moças assistiam ao filme Sissi a imperatriz e sonhavam com o homem perfeito ."
"processo seletivo","Seleção inclui entrevista pessoal .","As inscrições para a seleção são gratuitas .","Será publicado edital com informações sobre a seleção ."
"pronto-socorro","Há crianças que chegam esqueléticas ao hospital .","A explosão acabou com 18 hospitais e 32 postos de hospital .","Além disso , diariamente pessoas chegam no hospital com ferimentos de bala ."
"puro-sangue","A paixão é como um legítimo cavalo de raça .","Que fazer se os outros cavalos grandes e de raça tinham toda a prioridade ?","Acredita - se que seja o antecessor do cavalo árabe e de outros de raça ."
"quadro-negro","O primeiro cardápio da rede era escrito em uma lousa .","Quando muito diríamos que só são entes de giz na lousa .","Mário taca um giz em Suzana , enquanto ela escreve na lousa ."
"queda livre","De facto o PIB grego permaneceu em uma queda ininterrupta .","Jovens curtindo a adrenalina da queda em direção ao abismo .","Mesmo o preço no mercado europeu tem estado em queda !"
"quinta categoria","Somos um carro novo rodando a todo vapor com combustível ruim .","Acabou o capítulo de "" Amor e Revolução "" , um folhetim ruim .","Espetáculo de ruim com produção onerosa para o bolso do contribuinte ."
"rede social","Veja as redes de contatos como Facebook .","O Twitter não é uma rede de contatos .","As redes de contatos são os sites mais acessados ."
"regime político","A democracia é o seu sistema político .","O absolutismo foi abolido em favor do sistema político liberal .","Os gregos distinguiam três sistemas políticos : monarquia , aristocracia e democracia ."
"relógio analógico","Vem com formas coloridas e relógios .","A leitura de um relógio em ângulo muda de acordo com a posição de quem lê .","Engastes de alumínio escovado nas portas e volante dão uma dose extra de requinte ao interior do modelo , assim como o generoso relógio no centro do console ."
"relógio biológico","O relógio interno responde melhor se habituado a horários regulares .","O DNA mitocondrial funciona , assim , como um verdadeiro relógio interno .","A melatonina é a chave que controla o relógio interno do ser humano ."
"reta final","Estávamos no fim de provas .","Foram nove partidas sem derrota no fim .","Isto tudo às vésperas do fim da competição ."
"roda gigante","São brinquedos , trens de ferro , carrosséis .","O mais novo brinquedo de Londres provou ser um sucesso imediato .","A London Eye entrou para o Guinness , como a maior brinquedo do mundo ."
"roleta russa","De rejeição as eleições em São Paulo viraram uma espécie de jogo de azar .","É um jogo de azar com todas as balas no revólver , feito pelos partidos .","São duas horas de risadas , choros , nervosismo e um jogo de azar de emoções e sentimentos ."
"saia justa","Que situação difícil , muito constrangida tive que recusar .","Agora , está em uma tremenda situação difícil para julgar os demais casos .","De essa vez , o presidente norte - americano foi alvo de diversas insatisfações e situações difíceis ."
"sala cirúrgica","Em essas instituições , leitos e salas de cirurgia estão subutilizados .","Os primeiros estudantes da faculdade de medicina estagiaram em seus ambulatórios e salas de cirurgia .","Serão 100 novos leitos , 10 salas de cirurgia , 10 CTIs e mais espaço para hemodiálise eletiva ."
"salão paroquial","Os salões da igreja são importantes centros de decisão informal .","Lá íamos nós para os salões da igreja , as igrejas , os clubes .","Este prédio , que é o salão da igreja foi idealizado pelo padre Edir , já falecido ."
"sangue azul","Pelo menos no marketing , Sir Richard Branson tem nobreza : ele é o rei do marketing .","Ainda mais curioso , Washington não fora o único presidente americano a ter nobreza .","É o espírito nobre das pessoas , a chamada "" nobreza "" , o poder de liderança ."
"sangue frio","Assassinado em estilo de execução sem piedade .","O assassinato de 11 deputados colombianos sem piedade !","Carminha não mataria sem piedade o homem que amava ."
"sangue quente","Sim , ele tem a raiva espanhola !","A hispânia é um local cheio de pessoas de raiva e turistas .","Não , tem de reclamar agora , com o irritado mesmo , isso é um absurdo !"
"secretária eletrônica","Não há emails na caixa de entrada , não há recados na resposta automática e mesmo assim , você entende a mensagem .","Finja ser uma resposta automática , do pior jeito que você conseguir para ele perceber que está falando com um louco .","Ser breve , não abusar das ligações pessoais e responder às mensagens na resposta automática no prazo máximo de 24 horas"
"segundas intenções","Não tem malícia e muito menos malícia .","Ele manda uma cartinha meio sacana , cheia de malícia .","Padre com má - fé e com malícia é duro de engolir ."
"segundo plano","Para Júlio , tudo o mais estava em não prioritário .","A obediência está sendo relegada a não prioritária .","Os aspectos táticos e técnicos ficaram em não prioritário ."
"sentença judicial","Em 2004 saiu uma decisão judicial favorável aos moradores .","A indenização deverá ser determinada por decisão judicial .","O valor inclui vencimentos , encargos sociais e pagamentos de decisões judiciais ."
"sétima arte","Devo sem dúvida a essa precocidade cinéfila minha paixão pelo cinema .","Como já disseram , o filme não é o supra sumo do cinema .","Esta cena é reverenciada hoje como um dos grandes momentos do cinema ."
"sexto sentido","Foi um dia pesaroso , uma intuição me alertava que uma coisa ruim puxa outra .","A intuição é a percepção do outro energicamente .","E através da intuição , desenvolvendo a intuição e a plenitude do amor e da compaixão ."
"sinal verde","Agora , basta a aprovação da prefeitura em questão .","Rony deu aprovação para o combate .","Em seguida , a justiça francesa dá aprovação para a extradição ."
"sistema político","E uma política corrupta e clientelista .","É de todos os partidos da política brasileiro .","O franquismo foi uma forma de governo repressivo e autoritário ."
"tapete vermelho","Claro que eles arrasaram no Oscar .","Além disso , Daniel Cardoso fará as entrevistas direto do Oscar .","O canal TNT também está transmitindo direto do Oscar ."
"tartaruga-marinha","Conhecer as características principais da tartaruga do mar e da baleia jubarte .","Continuação da aventura da tartaruga do mar Sammy , que é capturada por humanos e levada para um aquário submarino .","Os ambientalistas optaram por realizar passeatas multicoloridas , vestidos de tartaruga do mar ."
"tela plana","Há moradores de favela com três televisores de tela reta .","Novos monitores de tela reta foram usados , usando menos espaço e deixando a ponte com um visual mais limpo .","Hoje ela tem tv de tela reta , dvd e máquina de lavar roupas ."
"tempo real","Acompanhe as projeções ao vivo .","É um monitoramento ao vivo .","Colaboração ao vivo com outros utilizadores ;"
"terceira idade","Criaram - se creches e centros de velhice .","Empresa fabrica produtos ortopédicos para a velhice .","Vi até uma senhora na velhice de triciclo ."
"terceira pessoa","O Guimarães Rosa se tratava de narrador externo .","E você pode alternar entre primeira e narrador externo .","Um exemplo de história em narrador externo é o Grande Gatsby de F . Scott Fitzgerald ."
"tiro livre","A infração resulta em falta indireta para o adversário .","Todas as faltas são diretas e sem barreira da equipe adversária .","Renan cobrou a falta na trave e desperdiçou ótima oportunidade de marcar ."
"trabalho braçal","Entre uma idéia e sua realização existe o trabalho manual .","Avessos a trabalho manual , os americanos deixam o serviço perigoso para imigrantes .","Os que fazem trabalho manual ao ar livre , talvez não necessitem de mais exercícios ."
"trabalho escravo","As fundações foram , igualmente , construídas por trabalho forçado .","A expropriação de propriedades onde for encontrado trabalho forçado .","Utilizam - se muito deles para promover trabalho forçado ."
"vaca louca","Depois surgiram a doença da encefalopatia espongiforme e a gripe do frango .","E pela ingestão de carne contaminada pela doença da encefalopatia espongiforme .","A doença da encefalopatia espongiforme apareceu quando o gado foi obrigado a se canibalizar ."
"vinho branco","Pra beber , vinho .","Prosecco nada mais é que tipo de vinho espumante .","Ponha meio copo de vinho seco e deixe evaporar ."
"vinho tinto","Combina perfeitamente com vinho vermelho Pinot Noir .","Frutas vermelhas marinadas no vinho vermelho .","Se você comprou um queijo menos maduro , escolha um vinho vermelho encorpado ."
"vista grossa","O governo ignorou e deixou a coisa rolar .","Aqueles que criticam Malafaia ignoram outros graves pecados .","Não ignore para crimes , por menores que sejam ."
"viva voz","Esses convidados nem sempre podem participar em voz alta ;","Hoje é a última vez que eu vou falar com você em voz alta .","Desafio qualquer pessoa a dizer que eu recomendei voto no Serra , que recomendei por escrito ou de voz alta o voto no Serra ."
"vôo doméstico","O aeroporto internacional oferece vôos nacionais , europeus e transatlânticos .","O site tem uma lista de todos os vôos nacionais e internacionais , duração e preços .","Os vôos nacionais são normalmente de Sydney , Melbourne , Brisbane , Adelaide e Perth ."
"vôo internacional","A agência nacional de vigilância sanitária tem como localizar quem viajou com os doentes , pois vinha recolhendo as guias de declaração de bagagens em viagens internacionais .","A Pan - Am , outra gigante , só operava viagens internacionais .","Esse destino se acrescenta a malha de viagens internacionais da TAM ."
"voto secreto","As eleições são realizadas por voto oculto .","A aliança pregava a justiça trabalhista , o voto oculto e o voto feminino .","O voto oculto era de absoluta necessidade , assim como o voto feminino ."
